"상품코드","자체 상품코드","진열상태","판매상태","상품분류 번호","상품분류 신상품영역","상품분류 추천상품영역","상품명","영문 상품명","상품명(관리용)","공급사 상품명","모델명","상품 요약설명","상품 간략설명","상품 상세설명","모바일 상품 상세설명 설정","모바일 상품 상세설명","검색어설정","과세구분","소비자가","공급가","상품가","판매가","판매가 대체문구 사용","판매가 대체문구","주문수량 제한 기준","최소 주문수량(이상)","최대 주문수량(이하)","적립금","적립금 구분","공통이벤트 정보","성인인증","옵션사용","품목 구성방식","옵션 표시방식","옵션세트명","옵션입력","옵션 스타일","버튼이미지 설정","색상 설정","필수여부","품절표시 문구","추가입력옵션","추가입력옵션 명칭","추가입력옵션 선택/필수여부","입력글자수(자)","이미지등록(상세)","이미지등록(목록)","이미지등록(작은목록)","이미지등록(축소)","이미지등록(추가)","제조사","공급사","브랜드","트렌드","자체분류 코드","제조일자","출시일자","유효기간 사용여부","유효기간","원산지","상품부피(cm)","상품결제안내","상품배송안내","교환/반품안내","서비스문의/안내","배송정보","배송방법","국내/해외배송","배송지역","배송비 선결제 설정","배송기간","배송비 구분","배송비입력","스토어픽업 설정","상품 전체중량(kg)","HS코드","상품 구분(해외통관)","상품소재","영문 상품소재(해외통관)","옷감(해외통관)","검색엔진최적화(SEO) 검색엔진 노출 설정","검색엔진최적화(SEO) Title","검색엔진최적화(SEO) Author","검색엔진최적화(SEO) Description","검색엔진최적화(SEO) Keywords","검색엔진최적화(SEO) 상품 이미지 Alt 텍스트","개별결제수단설정","상품배송유형 코드","메모"
"","SAF2026-110","Y","Y","43","Y","Y","머물고 싶은 순간 - 리호","","[110] 리호","","","장지에 호분, 분채 | 72.7×50.0cm","","<div><h2>머물고 싶은 순간</h2><p>리호</p><p>장지에 호분, 분채 | 72.7×50.0cm | 2023</p><h3>작가 이력</h3><p>2022 홍익대학교대학원동양화과박사재학중<br/>2022 홍익대학교대학원동양화과석사졸업<br/>2020 성신여자대학교미술대학동양화과졸업<br/><br/>주요단체전<br/>2025 <만류귀종>, 플로우앤비트, 서울<br/><NO MATTER>, N2 아트스페이스, 서울<br/>2024<관계전환지점>, 갤러리호호, 서울<br/><꿈과마주치다展>, 갤러리일호, 서울<br/><Landscape Liberation>, 갤러리자유, 서울<br/>2023 <사색속에는각자의소리가존재하고>, 에이라운지갤러리, 서울<br/><Greekyland 이상한나라의괴짜들2023>, K현대미술관,서울<br/><연말동시단체전Art Alliance 2023>, 갤러리모스, 서울<br/><현대미술과세종의만남–세종이야기미디어전시>, 광화문광장, 서울<br/>2022<갤러리시선2인공모기획전>, GS건설갤러리시선, 서울<br/><br/>아트페어<br/>2024 <2024 인사동YOUNG & FUTURE Art Fair>, 인사센트럴뮤지엄, 서울<br/>2023 <BAMA 부산국제화랑아트페어>, 벡스코, 부산<br/>2022 <FOCUS ART FAIR PARIS -Art Boom>, Carrousel du Louvre, 프랑스<br/>✣Email lda1016@naver.com<br/>✣Instagram @l_eeho<br/><br/>개인전<br/>2022<보이지않는프로젝트>, 사이아트도큐먼트, 서울</p></div>","A","","리호,씨앗페,SAF2026,미술,예술,작품","B","1500000","1500000","1500000","1500000","N","","","1","1","","","","N","N","","","","","","","","","품절","","","","","110.jpg","110.jpg","110.jpg","110.jpg","","","","","","","","","N","","","","","","","","","","","","","","","","","","","","","","","","","","","","","","",""
"","SAF2026-111","Y","Y","43","Y","Y","무지개 사냥꾼 - 김영서","","[111] 김영서","","","장지에 호분 | 72.7×60.6cm","","<div><h2>무지개 사냥꾼</h2><p>김영서</p><p>장지에 호분 | 72.7×60.6cm | 2025</p><h3>작품 설명</h3><p>스쳐 지나간 것에도 뒷모습이 있다면, 그것 또한 하나의 잔상이 된다. 지나간 시선과 장면들은 이미지로 남고, 그것들은 다시 인연이 되어 돌아온다. 내 작업은 그동안 스쳐 지나가며 본 사적인 시선들을 기록한 것이다.<br/><br/> 우리는 우연히 어떤 장면을 마주할 때 설명할 수 없는 익숙함을 느끼곤 한다. 프랑스 학자 롤랑 바르트(Roland Barthes)가 사람들이 사진을 보는 방식의 한 종류로 설명한 “푼크툼(punctum)”처럼 또렷이 떠오르지는 않지만 마치 한때 그 안에 있었던 것 같은 감각처럼 내 작업은 흐릿하고 오래된 흑백사진을 떠올리게 한다. 나는 여러 겹의 연필 선을 쌓으며 윤곽이나 세부 묘사는 생략한다. 머릿속 어딘가에 남아 있는 장면은 원래부터 흐릿했고, 그 불완전함 속에서 오히려 감정이 머물기 시작한다. 나의 시선을 통해 나의 회상, 그리고 보는 이들도 각자만의 해석을 만들어갈 수 있다.<br/><br/> 미학자 볼프강 켐프는 ‘서사(narrative)’에 대해 다음과 같이 말한다.<br/>“시각 예술은 최선의 그리고 무조건적인 가시성의 요인으로부터 시작한다. 사물과 행동을 가까이 가져오고자 하는 것이지 멀리 떨어뜨려 두려는 것은 아니다.”<br/><br/> 당연하게 들릴 수 있는 이 말은 오히려 나에게는 하나의 질문이 되었다.<br/>내 작업에 있어 ‘거리’는 물리적 공간이 아닌, 감각과 감정 사이에 존재하는 깊이의 문제이기 때문이다. 특정 장면을 떠올리는 행위는 언제나 시간의 파동을 일으키며, 흐릿함과 선명함, 이어짐과 끊김이 반복되는 가운데 한 조각의 이미지가 천천히 되살아난다.<br/><br/> 우리가 살아가는 매일의 순간들은 지나고 나서야 비로소 머물게 된다. 그렇게 쌓인 장면들은 나의 작업 안에서 희미해지기도 하고 오래 남기도 하며 잘 보관되기도 한다.<br/> 나의 작업은 언제 썼는지도 모르는 일기장 속 장면들을 꺼내볼 수 있는 기록의 의미가 담겨있다. 그 기록을 통해 우리는 문득 남아 있던 감각을 떠올리고, 익숙한 감정의 기운을 발견하게 된다. 나의 시선과 기록을 통해 각자의 시간 어딘가에 머물렀던 풍경을 다시 떠올릴 수 있는 계기가 되길 바란다.<br/></p><h3>작가 이력</h3><p>홍익대학교 일반대학원 동양화과 석사 / 졸업<br/><br/>개인전<br/>2022   <사라지는 것들의 아름다움>, 사이아트스페이스, 서울<br/><br/>주요 단체전<br/>2025	<만류귀종>, 아이디어회관, 서울<br/>	청년예술인 기획전 <사이 사이 쉼>, 문화실험공간 호수, 서울<br/>	4인전 <NO MATTER>, N2아트스페이스,서울<br/>	한겨레 큐레이팅스쿨 3기 선정작가 <사이, 혹은_사이>, 갤러리 일호, 서울<br/>2024	동작아트갤러리 전시기획 공모사업 선정전시 <흔적의 깊이>, 동작아트갤러리, 서울<br/>	<동시다발전 Art Alliance>, N2아트스페이스, 서울<br/>	신진예술가 공모전시 <고운 기록>, 문화실험공간 호수, 서울<br/>2023	신진작가 기획전 <작가 H의 상점>, 동탄아트스퀘어, 화성시문화재단, 경기도<br/>       	<동작:확장>, 동작아트갤러리, 동작문화재단, 서울<br/>       	3인 공모기획전, GS건설 갤러리시선, 서울<br/>       	<사색 속에는 각자의 소리가 존재하고>, 에이라운지, 서울<br/></p></div>","A","","김영서,씨앗페,SAF2026,미술,예술,작품","B","1400000","1400000","1400000","1400000","N","","","1","1","","","","N","N","","","","","","","","","품절","","","","","111.jpg","111.jpg","111.jpg","111.jpg","","","","","","","","","N","","","","","","","","","","","","","","","","","","","","","","","","","","","","","","",""
"","SAF2026-112","Y","Y","43","Y","Y","용감한 바람 - 김영서","","[112] 김영서","","","장지에 호분 | 72.7×60.6cm","","<div><h2>용감한 바람</h2><p>김영서</p><p>장지에 호분 | 72.7×60.6cm | 2025</p><h3>작품 설명</h3><p>스쳐 지나간 것에도 뒷모습이 있다면, 그것 또한 하나의 잔상이 된다. 지나간 시선과 장면들은 이미지로 남고, 그것들은 다시 인연이 되어 돌아온다. 내 작업은 그동안 스쳐 지나가며 본 사적인 시선들을 기록한 것이다.<br/><br/> 우리는 우연히 어떤 장면을 마주할 때 설명할 수 없는 익숙함을 느끼곤 한다. 프랑스 학자 롤랑 바르트(Roland Barthes)가 사람들이 사진을 보는 방식의 한 종류로 설명한 “푼크툼(punctum)”처럼 또렷이 떠오르지는 않지만 마치 한때 그 안에 있었던 것 같은 감각처럼 내 작업은 흐릿하고 오래된 흑백사진을 떠올리게 한다. 나는 여러 겹의 연필 선을 쌓으며 윤곽이나 세부 묘사는 생략한다. 머릿속 어딘가에 남아 있는 장면은 원래부터 흐릿했고, 그 불완전함 속에서 오히려 감정이 머물기 시작한다. 나의 시선을 통해 나의 회상, 그리고 보는 이들도 각자만의 해석을 만들어갈 수 있다.<br/><br/> 미학자 볼프강 켐프는 ‘서사(narrative)’에 대해 다음과 같이 말한다.<br/>“시각 예술은 최선의 그리고 무조건적인 가시성의 요인으로부터 시작한다. 사물과 행동을 가까이 가져오고자 하는 것이지 멀리 떨어뜨려 두려는 것은 아니다.”<br/><br/> 당연하게 들릴 수 있는 이 말은 오히려 나에게는 하나의 질문이 되었다.<br/>내 작업에 있어 ‘거리’는 물리적 공간이 아닌, 감각과 감정 사이에 존재하는 깊이의 문제이기 때문이다. 특정 장면을 떠올리는 행위는 언제나 시간의 파동을 일으키며, 흐릿함과 선명함, 이어짐과 끊김이 반복되는 가운데 한 조각의 이미지가 천천히 되살아난다.<br/><br/> 우리가 살아가는 매일의 순간들은 지나고 나서야 비로소 머물게 된다. 그렇게 쌓인 장면들은 나의 작업 안에서 희미해지기도 하고 오래 남기도 하며 잘 보관되기도 한다.<br/> 나의 작업은 언제 썼는지도 모르는 일기장 속 장면들을 꺼내볼 수 있는 기록의 의미가 담겨있다. 그 기록을 통해 우리는 문득 남아 있던 감각을 떠올리고, 익숙한 감정의 기운을 발견하게 된다. 나의 시선과 기록을 통해 각자의 시간 어딘가에 머물렀던 풍경을 다시 떠올릴 수 있는 계기가 되길 바란다.<br/></p><h3>작가 이력</h3><p>홍익대학교 일반대학원 동양화과 석사 / 졸업<br/><br/>개인전<br/>2022   <사라지는 것들의 아름다움>, 사이아트스페이스, 서울<br/><br/>주요 단체전<br/>2025	<만류귀종>, 아이디어회관, 서울<br/>	청년예술인 기획전 <사이 사이 쉼>, 문화실험공간 호수, 서울<br/>	4인전 <NO MATTER>, N2아트스페이스,서울<br/>	한겨레 큐레이팅스쿨 3기 선정작가 <사이, 혹은_사이>, 갤러리 일호, 서울<br/>2024	동작아트갤러리 전시기획 공모사업 선정전시 <흔적의 깊이>, 동작아트갤러리, 서울<br/>	<동시다발전 Art Alliance>, N2아트스페이스, 서울<br/>	신진예술가 공모전시 <고운 기록>, 문화실험공간 호수, 서울<br/>2023	신진작가 기획전 <작가 H의 상점>, 동탄아트스퀘어, 화성시문화재단, 경기도<br/>       	<동작:확장>, 동작아트갤러리, 동작문화재단, 서울<br/>       	3인 공모기획전, GS건설 갤러리시선, 서울<br/>       	<사색 속에는 각자의 소리가 존재하고>, 에이라운지, 서울<br/></p></div>","A","","김영서,씨앗페,SAF2026,미술,예술,작품","B","1400000","1400000","1400000","1400000","N","","","1","1","","","","N","N","","","","","","","","","품절","","","","","112.jpg","112.jpg","112.jpg","112.jpg","","","","","","","","","N","","","","","","","","","","","","","","","","","","","","","","","","","","","","","","",""
"","SAF2026-113","Y","Y","43","Y","Y","내맘도 몰라주고 - 오아","","[113] 오아","","","장지에 먹과 분채 | 72.7×60.6㎝","","<div><h2>내맘도 몰라주고</h2><p>오아</p><p>장지에 먹과 분채 | 72.7×60.6㎝ | 2025</p><h3>작품 설명</h3><p>‘ 상실의 온기’<br/><br/>나의 정서는 슬픔이다.<br/>그것은 특정 사건에 귀속되지 않은 채,일상의 저변에 낮게 깔려 있는 알 수 없는 슬픔에 가깝다.아동기 시절 격려보다 미난과 평가가 앞섰던 환경 속에서 성장한 경험은,그 안에서 스스로에 대한 신뢰를 충분히 형성하지 못한 채 타인의 시선을 의식하며 성장했다.이러한 위축된 마음은 오랜 시간 내면에 습관처럼 자리 잡았다.<br/>나는 나와 같은 사람들을 생각한다.기질적으로는 밝지만,억압된 환경을 지나오며 자신의 성향을 충분히 발휘하지 못한 채 살아온 사람들.결국 내가 선택한 방식은 타인에 대한 **‘공감 훈련’**이었다.나의 슬픔은 약함이 아니라 오래 버텨온 흔적이며,회화 작업은 이 정서를 바탕으로 인물을 대상화하기보다 공감의 대상으로 이해하고 표현하는 방향으로 이어졌다.<br/>이 슬픔은 단순한 우울에 머무르기보다,이미 지나가버린 시간과 관계에 대한 상실의 감각과 맞닿아 있다.작업을 시작할 때부터 이 상실을 화면 위에 담고자 했다.다만 내가 의도한 상실은 차갑게 단절된 상태가 아니라,사라진 이후에도 감정의 온도가 남아 있는 상태였다.그래서 나의 회화는 상실을 다루되,그 안에 따뜻한 온기를 함께 남기고자 한다.이는 떠나간 것 이후에도 관계를 포기하지 않으려는 태도에 가깝다. 이러한 태도는 내가 대상을 바라보는 시선,즉 **‘응시’**의 문제와 맞닿아 있다.나는 인물을 관찰할 때,그 안에 축적된 시간과 감정의 층위를 주목한다.눈은 단순히 사실을 인지하는 기관이 아니라,대상이 지나온 시간과 그 사이의 공기를 감각하는 매개체이며,나의 회화는 그러한 감각을 한 화면에 응축하는 장치가 된다.<br/>작업 과정에서 나는 수많은 유사한 장면을 가정하고,그중 가장 효과적인 시선을 선택한다.철저히 주관적인 선택이지만,동시에 하나의 관점에 불과하다는 사실을 인식하려는 태도이기도 하다.관객이 각자의 방식으로 인물을 응시하고 해석하며,그 안에서 새로운 의미와 관계가 생성되기를 바란다.나의 회화는 단일한 해석으로 수렴되기보다,관객의 시선을 분산되고 확장되는 상태를 지향한다.<br/>시선에 대한 이러한 인식은 색채에 대한 탐구로 이어진다.나에게 색은 조형적 언어를 넘어,일상의 경험과 감정,사고의 습관이 축적된 결과물이다.나는 나의 우울한 정서를 흑백으로 단정하고 싶지않았고,색을 통해 감정이 하나의 의미로 고정되기보다 복합적인 층위로 머무르기를 원했다.색에 대한 인식은 어린 시절 처음 마주한 흑인의 피부에서 느꼈던 깊고 다채로운 색감의 충격으로 이어져 나의 작업 전반에 걸친 색채 실험의 출발점이 되었다.그리고 내가 흑인을 통해 특정인물을 재현하기보다,나의 정서와 감각을 이입하고 대체하는 대상으로 표현하는 계기이기도 하다.관객은 인종에 대한 이슈를 떠올릴 수 있지만,나에게 그 인물은 타자라기보다 나 자신의 내면을 우회적으로 드러내는 존재에 가깝다.이때 색은 외형을 설명하는 요소가 아니라,감정을 대신 말하는 언어로 기능한다.나의 색은 시각적으로 인지되지만,동시에 촉각과 온도,밀도를 동반한 공감각적 감각으로 작동하며,관객이 인물을 바라보는 방식 또한 점차 감각의 층위로 이동하기를 의도한다.<br/>이러한 시지각을 중심의 태도는 작업의 재료를 선택과도 관련이 있다.아교와 분채를 다루는 느리고 집요한 과정은 고단하지만,그 결과는 선명하다.점차 사용이 줄어들고 있는 전통 채색 기법이지만,실제 작품을 마주한 관람자들은 재료에서 비롯되는 밀도와 깊이의 차이를 즉각적으로 인식하며,이 집요한 과정은 나의 정서와 태도를 가장 정확하게 담아낼 수 있는 방식이기도 하다.<br/>최근에 시작한 작업들은 나의 정서와 주변 인물들의 감정이 교차하는 지점을 인물 누드의 형식으로 다루고 있다.이는 감정을 가장 솔직하게 드러내는 형식이다,나는 회화를 통해 인물과 관객 사이에 공감의 여백을 남기고,그 간극 속에서 각자의 기억과 감정이 조용히 떠오르기를 바란다.</p><h3>작가 이력</h3><p>개인전<br/>2022‘달에서 달에게’ (아트스페이스 영,서울)<br/>2022‘짙은 방‘(아트로직스페이스,서울)<br/>단체전<br/>2025‘2025띠그림전’ (이천시립미술관,이천)<br/>2024‘In my loneliest hours’(인사갤러리,서을)<br/>2024‘AFindingPersona’(갤러리 언플러그드,서울)<br/>2024‘몽상 드로잉‘(갤러리 1707,서울)<br/>2023‘2023H-EAA전국청년작가 미술공모전 선정작가 10인전’ (아트스페이스 호화,서울)<br/>2023‘스며들다’ (갤러리일호,서울)<br/>2023‘유희의 모양’한겨레신문 (아띵갤러리,서울)<br/>2023‘사색은 각자의 소리가 존재하고’ (A-lounge갤러리,서울)<br/>2023‘BAMABUSAN’국제화랑아트페어 (BEXCO,부산)<br/>2023‘몽상드 한양‘ (갤러리1707,서울)<br/>2022‘형상의 바깥’ (금보성미술관,서울)<br/>2022‘FOCUSARTFAIR’(파리 까루젤 뒤 루브르,파리)<br/>2022‘아시아프’ (홍익대학교 현대미술관,서울)<br/>2022‘꿈과 마주치다’ 신진작가 (갤러리일호,서울)<br/>수상<br/>2023‘2023H-EAA전국청년작가 미술공모전,우수상 (호반문화재단)<br/>작품소장<br/>호반 문화재단</p></div>","A","","오아,씨앗페,SAF2026,미술,예술,작품","B","2000000","2000000","2000000","2000000","N","","","1","1","","","","N","N","","","","","","","","","품절","","","","","113.jpg","113.jpg","113.jpg","113.jpg","","","","","","","","","N","","","","","","","","","","","","","","","","","","","","","","","","","","","","","","",""
